ex_id,desc
00107,This innovative collaboration between the Department of Ancient and Byzantine Art and the Department of Prints and Drawings examines Renaissance and Baroque printmakers’ direct responses to Classical antiquity through the figure of Dionysos, the ancient Greek god of wine and theater. Installed in the Mary and Michael Jaharis Galleries of Greek, Roman, and Byzantine Art, this exhibition juxtaposes ancient sculpture with prints from the 15th through the 18th century with nearly 100 objects—pieces from the permanent collection, new loans of ancient art, and recently acquired works on paper.
Dionysos—known as Bacchus to the Romans—cavorted with an entourage of satyrs, the god Pan, and frenzied maenads, female followers of the god. All these devotees represented the untamed and hedonistic desires of humanity, which were unleashed by the intoxicating elixir of wine. Because performance was a part of the early Greek festivals of Dionysos, he also became known as the patron god of theater, an aspect of the deity that is less well known today. In ancient art, Dionysos could take many forms, from a graceful youth to a bearded mature man. During the Renaissance and Baroque periods, the time of early printmaking, interest in antiquity—especially Dionysos—flourished. Ancient sculptures depicting the god and his raucous retinue inspired artists to find new ways to transform age-old Dionysian subjects into prints and drawings that would appeal to their own contemporary audiences.
Anchoring the exhibition are Greek and Roman sculptures depicting Dionysos and his wild followers along with vessels used in ritual drinking parties and festivals honoring the god of wine and theater. Their printed counterparts are masterpieces from the Italian Renaissance to the French Rococo, including notably Andrea Mantegna’s Bacchanal with a Wine Vat, a 15th-century Italian engraving with striking visual similarity to the bronze Statue of Young Dionysos (a current long-term loan to the museum). Bringing together this rich selection of works, separated by as many as 1,500 years, this exhibition offers new, enticing insights into the art of Classical antiquity and its later revivals.
SponsorsSupport for this exhibition is generously provided by Shawn M. Donnelley and Christopher M. Kelly and the Jaharis Family Foundation, Inc.

00113,The most ephemeral of all Japanese prints, fans with printed images of popular kabuki actors, beauties, and landscapes were ubiquitous in Japan during the Edo period (1615–1868). Most were well used, which is why so few remain. However, those that were not destroyed by being mounted as fans on bamboo sticks have been preserved as part of the Art Institute’s collection. Highlighted in this exhibition are fans' unique format, as well some of their less obvious uses—catching insects and as a fashionable way to feature calligraphy. Fans were produced in specialized shops. While the round fans (uchiwa) duplicated Chinese prototypes, the folding fan (ôgi), was invented in Japan in the seventh century. All of these fans, however, were refined by the skill of an artist and transformed into charming, lightweight accoutrements that brought relief from the heat, comfort to the soul, and delight to the eye. Fans printed with images of favorite kabuki actors were one of the earliest and most favored prints for theater lovers to own. With the popularization of the landscape print, Utagawa Hiroshige (1797–1858) produced more printed images for fans than any other artist, even though these likely number less than 10 percent (about 350 designs) of his entire output. Because these prints were trimmed and pasted to either folding or round fans, few have survived, and therefore it is difficult to understand the total number that may have existed.There will be a rotation of some of the works at the midpoint of the exhibition.

00114,
00109,Inspired by the working process of international architect David Adjaye, this installation in the Ryan Learning Center interactive gallery invites visitors of all ages to discover how architects use building materials like wood, fabric, ceramic tiles, laminates, paint, stone, and plastics to create form and atmosphere. Visitors can arrange material samples and sketches to create a “mood board” (just like the professionals do) and consider how color, texture, and cultural context create a specific feel as well as how materials affect the way we experience architecture inside and out—from personal spaces to museum galleries to buildings in Chicago.
SponsorsThis project was funded by a grant from the Efroymson Family Fund.

00203,Conceived as a complementary exhibition to Pop Art Design, The Street, the Store, and the Silver Screen celebrates the MCA’s holdings of seminal pop art. During the 1960s, many artists gravitated toward the brash colors, simplified designs, and direct salesmanship of the burgeoning commercial world and incorporated these same strategies into their fine art practices. Associated with the pop art movement, these artists shocked viewers by attacking the rarity, preciousness, and financial independence that traditionally embodied fine art. Today, however, these icons of pop art are recognized as reflecting a culture in transition, one that was beginning to fully embrace the capitalism and mass communication that characterizes global culture now.

The exhibition is organized around three separate themes that illustrate many artists’ interests during the 1960s and 1970s: the bustling energy of the street, with its preening passersby, garish signage, and automobile-centric organization; the commercialism that supported and surrounded mass produced consumer products; and the allure of Hollywood glamour and celebrity. Drawn from the MCA Collection and a handful of local loans, these works reveal patterns and preoccupations that connect artists working in otherwise distinct styles and approaches. In the “Street” section, for instance, photo books by Ed Ruscha are presented with a concrete Cadillac in a collage by Wolf Vostell and a colorful streetwalker in a painting by Ed Paschke. In the “Store,” Andy Warhol’s silk-screened “portraits” of Campbell’s soup cans are joined by papier-mache sculptures of candy by Claes Oldenburg and a painting of an alluring female nude on top of a zebra by Mel Ramos, mimicking an often-used sales strategy in advertising. In the “Silver Screen,” we find glamour of various stripes, including 1950s heartthrob Troy Donahue in Andy Warhol’s painting Troy Diptych and the underground siren pictured in Paschke’s technicolor painting Elcina. The exhibition reveals the richness of the MCA’s holdings in this area of art history as well as the continued relevance and fascination that pop art has for us today.

This exhibition is organized by James W. Alsdorf Chief Curator Michael Darling at the Museum of Contemporary Art Chicago.

The exhibition is presented in the Griffin Galleries of Contemporary Art on the museum’s fourth floor. 

00202,While we may think we know pop inside-out through the well-documented and widely discussed work of Andy Warhol and his peers, the spirit of pop not only manifested itself in Warhol’s paintings of Marilyn Monroe and Campbell’s soup cans, it also influenced the look of chairs, sofas, lamps, and even architecture during the culturally ebullient 1960s and 1970s. Pop Art Design, an exhibition organized by the Vitra Design Museum, one of the preeminent furniture and design museums in the world, pairs iconic design objects with artworks from this celebrated era to show the cross-pollination between these creative worlds. This glimpse outside the precincts of fine art museums and galleries reinforces the pervasiveness of pop as a cultural phenomenon during this period. Designers such as Charles Eames, George Nelson, Ettore Sottsass, Achille Castiglioni, and Robert Venturi were just as enamored of the commercial buzz of Main Street as their fine art peers and equally embraced the banality of everyday objects, the vivid colors of advertising, and standardized fabrication at the heart of mass consumer products in the creation of their work. Their furniture, graphic design, and architecture exemplify the same pop spirit that swept the western world during this period, but have up until this point not received the attention they deserve. This exhibition, presented alongside a companion exhibition of classic pop works from the MCA collection, offers a fresh perspective on this prevailing period of cultural production.

This exhibition is organized by the Vitra Design Museum in Weil am Rhein, Germany. It is overseen at the MCA by James W. Alsdorf Chief Curator Michael Darling.

The exhibition is presented in the Griffin Galleries of Contemporary Art on the museum’s fourth floor. 

00206,Surrealism: The Conjured Life presents more than 100 paintings, sculptures, drawings, and photographs that demonstrate the deep currents that Surrealism sent through the international art world—and especially through Chicago—since its emergence in the first half of the twentieth century. A global movement that encompassed a wide number of art forms, including film, theater, poetry, and literature, Surrealism came of age with poet André Breton’s formal declaration in 1924. This deeply emotional and psychological art form flourished in the 1930s and 1940s—turbulent times of economic instability, rapidly changing social mores, and war.

Chicago collectors brought the European visual arts aspect of Surrealism to their hometown. Joseph and Jory Shapiro and Edwin and Lindy Bergman traveled to Europe, where they met members of the Surrealist group including Paul Delvaux, Matta, and Magritte, piquing their interest in this “art of the irrational.” Mary and Earle Ludgin collected in depth the works of eccentric American painter Forrest Bess. These arts patrons were among the founders of the MCA, and when the museum began collecting in the mid-1970s, they donated major works by those we now consider “classical” Surrealists, forming an early and continuing collection strength. These artworks also proved inspirational to generations of Chicago-based artists, from the immediate postwar group dubbed the Monster Roster to the Hairy Who and others, a further expression of the continuing lure of “the conjured life” that results in strange, often magical, and sometimes disturbing, imagery.

Though often framed as a largely historical movement, the freedom afforded by Surrealism to explore both formal issues—including experimenting with new materials and techniques—and personal expression has continued to inspire artists to the present day. Thus besides presenting works by the founders of the movement, the surrealist tendency is traced in two other groupings: Surrealist-related works from the 1950s to the present, and Chicago connections. Artists including Balthus, Leonora Carrington, and Dorothea Tanning round out the presentation of the classical Surrealists. Major international contemporary artists such as Lee Bontecou, Mark Grotjahn, Wangechi Mutu, Cindy Sherman, and Francesca Woodman represent the stylistically diverse Surrealist-related grouping. Chicago-based artists on view include Gertrude Abercrombie, Leon Golub, Jim Nutt, Christina Ramberg, and H. C. Westermann.

The exhibition highlights one of the most traditional values in the visual arts: looking. All of the artworks that populate The Conjured Life bear close scrutiny, both in observing and exploring the subject matter and noting the various visual strategies and formal means, from the straightforward representation of Magritte to the low-relief plaster technique of Max Ernst; from the shamanistic deer skin, wood, and felt used by Jimmie Durham to the full-size rubber life raft cast in bronze by Jeff Koons.

The exhibition is curated by Lynne Warren, Curator at the Museum of Contemporary Art Chicago.

The exhibition is presented in the Bergman Family Gallery, Lindy and Edwin A. Bergman on the museum’s second floor. 

00207,Longtime member of Chicago’s art community, Diane Simpson (American, b. 1935) makes distinctive sculpture that have gained recognition both nationally and internationally. Originating as a commission from the Racine Art Museum, Wisconsin, which occupies a former department store, Window Dressing was designed for the museum’s six street-level display windows. Four of these six tableaux make their Chicago premiere in this presentation. Each window display consists of an individual sculpture that evokes clothing and accessories set against a backdrop that incorporates the geometric patterns and streamlined curves of the Art Deco period. To seamlessly combine the sculptures with the backdrops, Simpson also crafted stands, platforms, hangers, and other display furniture. Simpson’s ambitious project pays homage to the pioneering window dressers of the early 20th century who developed the field of merchandise display.

Simpson’s manner of working has always been process-driven. She plays with abstraction, figuration, color, and form to create works that fuse material culture and fine art. Inspired by clothing from a wide variety of cultures and eras, Simpson carefully researches and renders these utilitarian items into two-dimensional drawings. She then realizes the final works—which in this presentation include a bowler hat and a woman’s pinafore—in three dimensions, often schematizing or exaggerating their original forms. Hand-constructing the sculptures from a wide range of materials, Simpson cuts, stitches, wraps, folds, ties, and rivets these items together to create the final pieces. To provide a glimpse into her working process, the exhibition also features research materials selected by the artist. They include trade manuals and journals of the 1920s and 1930s, as well as scale models for the some of the finished works.

The exhibition is organized by Lynne Warren, Curator at the Museum of Contemporary Art Chicago.

The exhibition is presented in the Carol and Douglas Cohen Gallery and Stone Family Gallery, Ellen Stone Belic and Dr. Nenad Belic, Cynthia and Richard Raskin, Carole David Stone and James H. Stone on the museum’s fourth floor. 

00201,Puerto Rican–born artist Rafael Ferrer has worked in a broad range of forms since first emerging as a national and international figure in the late 1960s. During the heyday of avant-garde explorations in the late 1960s and early 1970s, Ferrer (who studied with such well-known Surrealist figures as Wifredo Lam and André Breton) was one of the prime instigators of a movement now called process art, which focused on the process of creating rather than on the resulting object. His early installations, featuring ephemeral materials such as leaves, quickly evolved into installations that were more narrative in nature and that included evocative, handcrafted artifacts such as the corrugated steel Kayak #2: Norte (1973). This sculpture is a central feature of the exhibition and acknowledges Ferrer’s birthplace on an island, as well as his many voyages away from his homeland. During this same period, Ferrer also fashioned maps and flags and began his ongoing series of vibrantly colored, highly imaginative paper bag faces, examples of whic are included in the exhibition to contextualize Kayak.

Another major feature of the exhibition is the colorful and powerful cycle of paintings Cien Años de Soledad (One hundred years of solitude) (1982), which illustrate Nobel Prize–winning writer Gabriel García Márquez’s extraordinary novel set in the author’s native Colombia, in the fictional town of Macondo. The founder of Macondo believes his town is really an island and alternates between feelings of isolation and wanderlust, imagining the possibilities beyond the island’s shores—a constant theme in Ferrer’s work. Painted in a direct and willfully naïve style, the Cien Años works are alluring because of their color and immediacy yet unsettling due to scale shifts and depictions of savagery and violence. 

The concentration of works by Ferrer in the MCA collection reflects the museum’s long association with the artist, including the MCA’s presentation of his 1972 solo exhibition, Tierra del Fuego (Land of fire), referencing a group of islands off the southern tip of South America named by explorer Ferdinand Magellan. A Flag for the Straits of Magellan (1972), a major work featuring a pennant of fabric on which the artist painted and affixed rawhide, bone, wire, pipe cleaners, and other materials, was a prominent part of this important early exhibition and was created especially for the MCA. In recognition of the MCA’s early support of Ferrer, his longtime friends and collectors Earl and Betsy Millard of St. Louis have given the museum many of the works on display.

MCA DNA: Rafael Ferrer is part of an ongoing exhibition series featuring iconic works from the MCA collection. This exhibition is organized by Lynne Warren, Curator at the Museum of Contemporary Art Chicago.

The exhibition is presented in the McCormick Tribune Orientation Gallery on the museum’s second floor. 

00213,While Chicago art making has historically been strongly figural and representational, the Minimalism and conceptual art movements of the 1960s had a definite impact on many Chicago-based artists who emerged in the late 1980s and early 1990s. In the early 1980s there was a marked change in the Chicago art scene as the city’s art schools began attracting students and working artists from around the nation who had absorbed the lessons of the previous decades’ avant-garde and who were influenced by the theoretical writings of historians, philosophers, environmentalists, and literary critics. The following years saw a rise in the number of Chicago-based artists whose works were in the lineage of or consciously referred to conceptual art. The pioneering exhibition program at artist-run space Randolph Street Gallery (founded 1979) allowed many of the artists we now consider Chicago’s finest, such as Jeanne Dunning, Iñigo Manglano-Ovalle, Dan Peterman, and Tony Tasset, both to exchange ideas and to position their works in a broader social and cultural context. Galleries including Feigen Inc. and Feature showed work by these young artists alongside that of emerging national figures such as Charles Ray and Mike Kelley.

More than a dozen artists working in painting, photography, sculpture, and installation are represented in this exhibition, and their modes of abstraction are likewise diverse. Sculptors Richard Rezac and Tony Tasset use simple forms that emphasize the expressive qualities inherent in their industrial materials, while Dan Peterman, a pioneer in exploring environmental and sustainability issues, uses recycled materials to focus his conceptual and aesthetic concerns. Painters Julia Fish and Mitchell Kane abstract nature to an almost unrecognizable degree to create poetic canvases. Using photography, Jeanne Dunning focuses on the landscape of the body, and Iñigo Manglano-Ovalle maps the DNA of twins, both resulting in abstract portraits, while Gregory Green fashions a Minimalist grid out of saw blades in his kinetic installation. All of these artists employ the undeniable beauty of their materials and abstract compositions to convey complex ideas about art history, social issues, and identity.

MCA DNA: Chicago Conceptual Abstraction is part of an ongoing exhibition series featuring iconic works from the MCA Collection and is organized by Lynne Warren, Curator at the Museum of Contemporary Art Chicago.

00204,Kathryn Andrews (American, b. 1973) examines how image producers—such as artists, corporations, Hollywood studios, and politicians who mirror and shape social values at large—employ visual cues and material packaging to elicit desire. In doing so, she often calls attention to our power, or lack of power, to resist such forces and the complicated act of looking itself. Her sculptures, installations, and performances sample the aesthetics of pop art, minimalism, and conceptualism as readymades, and reinscribes them into new narratives about gender, class, and race.

Kathryn Andrews: Run for President, the artist’s first solo museum exhibition in the United States, features the sculptures that have made her one of the crucial new voices of her generation. For this exhibition, Andrews situates her sculptures against a conceptual and, at times, pictorial backdrop of presidential elections that functions as a rich allegory. The linear narrative explores candidates, campaigns, sitting in office, and the end of presidency, charting the rise and fall of the president—a metaphorical double for the figure of the artist as well as the viewer. Revealing cultural connections that are both humorous and critical, while questioning the consequences of seeing anything as fixed, Andrews demonstrates how meanings are always contingent and in flux.

This exhibition is organized by Julie Rodrigues Widholm, former Curator at the Museum of Contemporary Art Chicago.

The exhibition is presented in the Bergman Family Gallery, Lindy and Edwin A. Bergman on the museum’s second floor. 

00212,The 1960s were important years for artists and friends Andy Warhol (American, 1928–1987) and Marisol (Marisol Escobar, American, b. France, 1930), and marked a formative period in the development of their individual careers. Warhol began using his celebrated silk screen techniques to produce serial paintings, often based on mass media images. Marisol made the first of many portraits and developed her signature style, wooden sculptures with flat painted surfaces and additional elements such as everyday objects or plaster castings. Both were prominent figures in New York City’s lively art scene during this time. The two attended events together and each exhibited their work in solo shows at Eleanor Ward’s Stable Gallery as they came to be identified with the rising pop art movement. Warhol and Marisol even turned to one another as occasional subjects: Marisol made a sculptural portrait of Warhol in the early 1960s, titled Andy; and around the same time, Warhol featured Marisol in some of his early, and now legendary, films.

Inspired by the multifaceted relationship of these two artists, MCA DNA: Warhol and Marisol presents a focused selection of their works, side-by-side, drawn primarily from the collection of the Museum of Contemporary Art Chicago. Key examples of Warhol’s silk screen paintings and Marisol’s wood sculptures illuminate the artists’ respective approaches to portraiture while the pairing of their work brings certain affinities into view, including a similar use of repeating figures. At the same time, their methods diverge in significant ways, perhaps most visibly in the contrast between Warhol’s overtly mechanical approach to painting and Marisol’s more handcrafted, labor-intensive techniques as a sculptor.

MCA DNA: Warhol and Marisol is organized by MCA Curator Lynne Warren and MCA Curatorial Assistant Karsten Lund.

00208,British artist Phil Collins's (b. 1970) work may seem lighthearted at first, but his sensitive explorations of the interconnectedness among diverse individuals have earned him serious attention, including a Turner Prize nomination. In 2004 he travelled to Bogotá and assembled a group of musicians to record a note-for-note instrumental version of the Smiths’s 1987 album The World Won’t Listen. Collins then advertised citywide in radio ads and print media, inviting Smiths fans to perform karaoke versions of their favorite songs. The block-print posters Collins used—similar in design to posters used for political rallies or boxing matches—are included in the exhibition. Colombians showed up in droves to Collins’s recording sessions, and el mundo no escuchará presents a compilation of their passionate performances in front of a series of scenic backdrops. 

A first-generation Smiths fan himself, Collins traces the group’s enduring impact across the world in this work, the first in a trilogy of Smiths karaoke videos (the artist made subsequent versions in Turkey and Indonesia) that reveal the universal appeal of the band’s moody pop sensibility and their ability to capture teenage angst and alienation. Though many of the singers are not fluent in English, the album’s lyrics are not lost on them—as evidenced by their moving and vulnerable renditions. During the intimate and transformative act of singing, the karaoke performers transcend language barriers to embody the pathos, signature melancholy sound, and gestures of the band’s lead singer, Morrissey. 

el mundo no escuchará makes visible the wide range of emotions the camera provokes, including embarrassment, failure, honesty, sincerity, self-consciousness, anxiety, and sentimentality. Simultaneously revealing pop culture’s ubiquity and the personal meaning each song holds for the performers, Collins contributes to a larger movement in contemporary art—one in which questions of performance intersect with trajectories of identity formation, self-expression, and confession.

This exhibition is organized by Michelle Puetz, former Andrew W. Mellon Postdoctoral Fellow at the Museum of Contemporary Art Chicago.

It is presented in the Turner Gallery on the fourth floor.

