ex_id,desc
00211,MCA DNA: Alexander Calder traces the development of the artist’s ideas over a 50-year career, in particular, his exploration of how art can move in response to its physical environment. The exhibition presents examples of Alexander Calder’s (American, 1898–1976), mobiles, stabiles, and works on paper dating from the 1920s to the 1970s—a selection of the museum’s in-depth holdings of the seminal artist’s work. The core of this collection comes from the Ruth and Leonard Horwich Family Loan, which Museum of Contemporary Art Chicago has housed, cared for, and displayed since 1995. The Horwich family were, and remain, preeminent collectors of surrealist and Chicago Imagist art; and, as some of the founders and earliest supporters of MCA Chicago, helped to build the museum’s collection.

Trained as an engineer, Calder applied his knowledge of mechanics to colorful abstract shapes. Activated by air currents, his dynamic mobiles are ever-changing compositions. Marcel Duchamp invented the word mobile to describe Calder’s revolutionary work. Even Calder’s Flamingo (1973)—located in Chicago’s Loop—and his other static sculptures, dubbed stabiles by Jean Arp, evoke movement as they invite viewers to contemplate them from every angle.

The city of Chicago was important to Calder. In 1935, the Renaissance Society and the Arts Club of Chicago hosted one of his early solo exhibitions in the United States. The Horwich family amassed a significant Calder collection, befriending the artist and ultimately acquiring more than two dozen of his artworks. In 1974, as part of the inaugural ceremonies for Flamingo, then-Mayor Richard J. Daley declared a “Calder Day,” and Calder was carried to the sculpture’s dedication by a circus-themed parade on State Street. As part of these festivities, the MCA mounted a major Calder exhibition, and his art has been a steady presence in the museum’s galleries ever since.

MCA DNA: Alexander Calder is part of an ongoing exhibition series featuring iconic works from the MCA Collection and is organized by Michael Darling, James W. Alsdorf Chief Curator at the Museum of Contemporary Art Chicago.

00210,Richard Hunt (American, b. 1935), a longtime resident of Chicago and one of the city’s most accomplished artists, has contributed significantly to the history of abstract sculpture. Hunt turns eighty in 2015, and the MCA celebrates his life and artistic achievements with an MCA DNA exhibition of his sculptures and drawings, dating from the 1950s through the 1990s. These works reflect the development of Hunt’s style—from smaller objects made of welded scrap materials to monumentally scaled metal sculptures. Throughout his career, Hunt has used bronze and steel in his sculptures to explore lyrical forms, the sublime possibilities of abstraction, and the reconciliation of the organic and the industrial. Presenting a selection of Hunt’s drawings as well, the exhibition highlights his cultivation of linear gestures and a sense of movement in his work in both media.

Hunt’s career, which spans more than fifty years and continues today, began with early success, at the time largely unprecedented for a young artist. The Museum of Modern Art, New York, acquired one of Hunt’s sculptures in 1957, when he was still a student at the School of the Art Institute of Chicago, and mounted a retrospective of his work in 1971, when Hunt was only thirty-five. Hunt has received a Guggenheim Fellowship, fifteen honorary degrees, and a Lifetime Achievement Award from the International Sculpture Center, New Jersey. In addition, he has completed more than 120 major public commissions around the US and Chicago is home to thirty-five of his public sculptures, including works at Midway Airport and the historic State of Illinois Building. Hunt’s exhibition at the MCA is accompanied by an interactive map locating his public commissions, as well as a new video, produced by the MCA, that features Hunt discussing his work.

This exhibition is organized by Naomi Beckwith, Marilyn and Larry Fields Curator at the Museum of Contemporary Art Chicago.



00215,MCA DNA: William Kentridge is part of an ongoing exhibition series featuring iconic works from the MCA Collection. Acclaimed for his work in animated film, visual art, theater, and opera, Kentridge had his first survey exhibition in the United States in 2001 at MCA Chicago. From this exhibition, the MCA acquired more than a dozen drawings and two of his best-known films: Felix in Exile (1994) and History of the Main Complaint (1996), both of which will be on view. The drawings featured in the exhibition are those used to make this latter film—charcoal sketches that Kentridge erased and reworked to create the memorable segments that depict his alter egos and their struggles in late and post-apartheid Johannesburg: Felix Teitlebaum, the romantic artist who is always shown nude, and Soho Eckstein, the self-absorbed, wealthy mine owner and land developer who always wears a pinstriped suit. Although he is best known for his short animated films, Kentridge considers the activity of drawing the basis of his work. He has stated, “I believe that in the indeterminacy of drawing, the contingent way that images arrive in the work, lies some kind of model of how we live our lives. The activity of drawing is a way of trying to understand who we are and or how we operate in the world. It is in the strangeness of the activity itself that we can detect judgments, ethics, and morality.”

Like much of Kentridge’s work, History of the Main Complaint addresses issues of memory, truth, and reconciliation—issues that gripped South Africa in the immediate post-apartheid period, during which the Truth and Reconciliation Commission held public hearings to recover lost histories, to make reparations to those who had suffered, and to provide amnesty.

Also on view is the torn-paper collage Portage (2000), which features pages from a vintage French-language encyclopedia as its background. Created specifically for the catalogue that accompanied the MCA’s 2001 exhibition of the artist’s work, this collage depicts the march of variously weary, stalwart, and exuberant characters in silhouette and is a poignant commentary on the human condition, rooted in the dramatic events of South Africa’s recent history. This will be the first showing of Portage in its entirety.

This exhibition is organized by Lynne Warren, Curator at the Museum of Contemporary Art Chicago.

00205,Brazilian artist Alexandre da Cunha (b. 1969) is a poet of found materials. Rarely making objects from scratch, Da Cunha instead finds wondrously creative ways to repurpose already-existing items, revealing their inherent if overlooked form, beauty, and mystery. For a 2013 exhibition at the MCA, Homebodies, Da Cunha fashioned an undulating wall made with mop heads that mimicked a midcentury modern architectural feature. He has also performed this alchemy with straw hats, plastic soda bottles, umbrellas, and striped awning fabric. For the MCA’s ongoing Plaza Project series, Da Cunha presents objects of a more urban scale to address this particular site.

Mix (Americana) (2013) is a full-scale cement mixer liberated from its typical location on the back of a delivery truck. Cleaned up and set on the plaza as an object of beauty, this red-white-and-blue vessel is not only meant to inspire double-takes for visitors passing through the area, it also functions as a strange, quasi-kaleidoscopic viewing device: when viewers peer into its open end, complex shadows, forms, and the depth of the interior chamber are revealed as sunlight filters down into the barrel through a hole in the top. Da Cunha is also exploring the use of precast concrete sewer pipes—like those coursing underneath Chicago—to make artistic arrangements from the different sizes and shapes that are available to the construction trade.

Da Cunha’s activation is the fifth MCA Plaza Project. The series previously featured work by Yinka Shonibare, MBE (2014), Amanda Ross-Ho (2013), Martin Creed (2012), and Mark Handforth (2011).

This exhibition is curated by Michael Darling, James W. Alsdorf Chief Curator at the Museum of Contemporary Art Chicago.

The exhibition is presented on the Efroymson and Hamid Family Sculpture Plinth and on the museum’s plaza. 

00209,The Los Angeles–based architecture firm Johnston Marklee, founded by Sharon Johnston and Mark Lee, have been hired by the MCA to create a master plan for the museum, which includes a redesign and relocation of the restaurant as well as other public spaces. To coincide with the inaugural Chicago Architecture Biennial, Johnston Marklee have designed an intervention in the museum’s current café space that refers to the predominant grid of the building’s original architect, Josef Paul Kleihues, and hints at some ideas being considered for the renovations to come. Inaugurated in 1996, the MCA building was designed on a rigorous grid-based logic which not only influenced the proportions of the spaces inside the building, but also the rhythms of the fenestration and cladding on the exterior. Johnston Marklee’s immersive installation further emphasizes the proportions of this grid system by applying a repeating square graphic on the café walls, as well as creating a gridded ceiling plane that cuts the double height space in half, making for a more intimate scale. This dropped ceiling plane alludes to one idea Johnston Marklee are considering in their redesign of the space, where a mezzanine floor may be inserted into this space to create rooms for art making and meetings above and a social engagement space below. One characteristic of Johnston Marklee’s approach to the masterplan and restaurant project is a deep respect and understanding of the Kleihues building and this intervention for the Biennial is consistent with that rapport.

The installation is presented in the ComEd Lakefront Café on the museum's second floor.

00214,Part of an ongoing exhibition series featuring iconic works from the MCA Collection, MCA DNA: John Cage is presented on the occasion of the artist’s centenary year. It traces the fruitful and decades-long relationship between the Museum of Contemporary Art Chicago and this celebrated avant-garde composer and artist. Cage supported the museum from the very beginning, performing in a work with fellow Fluxus collaborators Dick Higgins and Allison Knowles as part of the October 1967 opening celebration of MCA Chicago’s inaugural exhibition, Pictures to be Read/Poetry to be Seen. Over the years Cage returned numerous times to Chicago, where he had lived in the early 1940s, often stopping at the MCA to execute various projects or see friends. Other artists also frequently performed Cage’s works at the MCA, notably the pioneering video artist Nam June Paik and cellist Charlotte Moorman in a 1969 program titled “Mixed Media” that featured Variations III and 26’1.1499” for a String Player.

Perhaps his best-known project associated with the MCA was part of the 1982 New Music America festival. For this pioneering music festival, administered by the MCA, Cage realized A Dip in the Lake: Ten Quicksteps, Sixty-two Waltzes, and Fifty-six Marches for Chicago and Vicinity (1978), a score created on a map of Chicago. Materials demonstrating how to interpret the score of this important work, which later entered the MCA Collection, are on view along with scores and books drawn from the more than 80 items associated with Cage in the MCA Artists’ Books Collection. Ephemeral materials, such as letters written to MCA staff and other historical documents that trace Cage’s legacy at the MCA, are also displayed.

This exhibition is organized by Lynne Warren, Curator at the Museum of Contemporary Art Chicago.

00327,Louisiana heiress and philanthropist Matilda Geddings Gray (1885–1971) acquired her first object by Fabergé in 1933. An artist herself, with a refined aesthetic sensibility, she was a sophisticated collector, while the name of the Russian artist-jeweler Peter Carl Fabergé (1846–1920) was almost unknown in the United States. Over the following years, Matilda Geddings Gray amassed one of the finest Fabergé collections in the world, and Fabergé's art has become widely known and internationally sought after.
A selection of works by Fabergé from Matilda Geddings Gray's sumptuous collection is on long-term loan at The Metropolitan Museum of Art, and comprises this exhibition. Objects originally commissioned by and created for the Romanov family, such as the Lilies-of-the-Valley Basket—the most important Fabergé work in a U. S. collection—and three magnificent Imperial Easter Eggs, are on view. The exhibition will display works from the collection on a rotating schedule for five years. Iconic works from the House of Fabergé have not been on public view in New York since 2004.
            
                After Matilda Geddings Gray died in 1971, her collection passed to the foundation she had established, with the stipulation that a broad public should be able to enjoy it. The collection was on view for many years at the New Orleans Museum of Art and at the Cheekwood Botanical Garden and Museum of Art in Nashville. Earlier this year, the rare Imperial Napoleonic Egg and Lilies-of-the-Valley Basket from the collection were featured in the exhibition Fabergé Revealed at the Virginia Museum of Fine Arts, Richmond.
Peter Carl Fabergé (1846–1920) was a talented artisan and jeweler but also a visionary. In 1872 he took over his father's small atelier in Saint Petersburg and within forty years transformed it into the world's largest enterprise of its kind, employing some five hundred craftsmen and designers. During the 1870s Peter Carl Fabergé had ongoing and open access to the world-renowned collections of the Hermitage for cataloging, repairing, and restoring precious pieces, particularly ancient gold pieces of jewelry. In 1882, at the Pan-Russian Exhibition held in Moscow, he was awarded the gold medal for his accurate replicas of those objects, drawing the attention of the czar and of the Imperial family. In 1885 the House of Fabergé was nominated "Goldsmith by special appointment of the Imperial Crown" and received the commission for the first Imperial Easter Egg. The firm rapidly grew to become the largest jewelry enterprise in Russia, and from 1882 to 1917 (when the Russian Revolution brought an end to the Fabergé production), the House of Fabergé produced thousands of objects ranging from silver tea sets to objets de luxe. The artisan died in Lausanne, Switzerland, in 1920.
The exhibition features three of the fifty Imperial Easter Eggs created for the Romanov family by Fabergé beginning in 1885. Records show that the eggs were initially commissioned by Czar Alexander III for his wife, Maria Feodorovna, and then by his son and heir, Czar Nicholas II, for his mother and his wife. The creation of each Imperial Easter Egg required the work of many people—designers, gem cutters and setters, engravers, enamelers, polishers—and each could take more than a year to complete. The three Imperial Easter Eggs on view include the Imperial Danish Palaces Egg, which Czar Alexander III presented in 1890 to his wife, and which is divided into twelve sections in opalescent pink enamel with diamonds, emeralds, and sapphires. It opens to reveal a surprise folding ten-panel screen that bears miniatures of the Empress's favorite Danish and Russian retreats. The Imperial Caucasus Egg, an opulent piece adorned with diamonds, pearls, crystal, and ivory, has four oval doors, each of which opens to reveal a different miniature view of Abastuman, the imperial hunting lodge in the Caucasus Mountains. And the Imperial Napoleonic Egg, which Czar Nicholas II presented to his mother, the dowager empress Maria Feodorovna, on Easter 1912, commemorates the centenary of the Russian victory over the armies of Napoleon, revealing a folding six-panel screen with miniatures showing the six regiments of which the dowager empress was an honorary colonel.
Another highlight of the exhibition is the Lilies-of-the-Valley Basket, considered to be Fabergé's floral masterpiece. It is the most important piece by the artisan in any collection in the United States. Made in 1896, it was originally presented to Czarina Alexandra Feodorovna and consists of nineteen individual stems emerging from nine separate plants in a "moss" of spun, fused, clipped, and polished green and yellow gold. Each pearl blossom is edged in silver set with rose-cut diamonds, with realistic leaves made of hard, dense nephrite and carved with the striations characteristic of the lily-of-the-valley plant. The czarina adored the Lilies-of- the-Valley Basket, as the blossoms were among her favorite flowers, and pearls her favorite jewels. She kept it on view in the private apartments and often took it with her when traveling.
            
            
                
                    Read more
00302,Elisabeth Louise Vigée Le Brun (French, 1755–1842) is one of the finest eighteenth-century French painters and among the most important of all women artists. An autodidact with exceptional skills as a portraitist, she achieved success in France and Europe during one of the most eventful, turbulent periods in European history.
In 1776, she married the leading art dealer in Paris; his profession at first kept her from being accepted into the prestigious Académie Royale de Peinture et de Sculpture. Nevertheless, through the intervention of Marie Antoinette, she was admitted at the age of 28 in 1783, becoming one of only four women members. Obliged to flee France in 1789 because of her association with the queen, she traveled to Italy, where in 1790 she was elected to membership in the Accademia di San Luca, Rome. Independently, she worked in Florence, Naples, Vienna, St. Petersburg, and Berlin before returning to France, taking sittings from, among others, members of the royal families of Naples, Russia, and Prussia. While in exile, she exhibited at the Paris Salons.
She was remarkable not only for her technical gifts but for her understanding of and sympathy with her sitters. This is the first retrospective and only the second exhibition devoted to Vigée Le Brun in modern times. The eighty works on view include paintings and a few pastels from European and American public and private collections.
00326,Over the last forty years, the Metropolitan's collection of Chinese painting and calligraphy has grown to be one of the greatest in the world. Replete with masterpieces dating from the Tang dynasty (608–917) to the present, the collection encompasses the vast historical sweep of the brush arts of China, from meticulous court painting to fiercely brushed dragons to lyrical paintings by scholars.
This exhibition, presented in two rotations, will highlight the gems of the permanent collection in a chronological display, with an emphasis on works from the Song (960–1279) and Yuan (1271–1368) dynasties.
00322,The traditional East Asian lunar calendar consists of a repeating twelve-year cycle, with each year corresponding to one of the twelve animals in the East Asian zodiac. This Lunar New Year, which begins on February 8, 2016, is the Year of the Monkey. In celebration, the Metropolitan Museum is pleased to present this small exhibition in the Charlotte C. Weber Galleries for the Arts of Ancient China, featuring depictions of monkeys in various media—including painting, ceramics, metalwork, and jade carving.
The earliest-known record of these zodiac animals is from China's Eastern Han Dynasty (25–220 A.D.) and dates to the first century. In sequence, the twelve animals are: rat, ox, tiger, rabbit, dragon, snake, horse, ram, monkey, rooster, dog, and pig. Each animal is believed to embody certain traits expressed in the character of the people born in that year. People born in the Year of the Monkey are thought to be intelligent, energetic, and playful.
The monkey has been a popular decorative figure in Asian art for over two millennia, often serving as a rebus or visual pun conveying the notion of academic success or accomplishment. In a fan painting from the late twelfth century that depicts three gibbons raiding an egret's nest, the gibbon acts as a visual pun, because the Chinese word for gibbon (yuan) is a homophone for "first place in the civil exam." Similarly, in a porcelain plate from the late seventeenth or early eighteenth century, a depiction of monkeys conveys a wish for high rank, as the Chinese word for monkey (hou) is a homophone for "marquis," or "commander."
The Chinese lunar calendar and its associated iconography eventually spread to Korea, Japan, and Chinese communities throughout Southeast Asia. While the symbolism of the Chinese lunar calendar is distinct to East Asia, images of monkeys, characterized by intelligence, lively spirit, and mischievous behavior, have universal appeal and are found in the decorative art of many cultures around the globe.
00304,This special display of instruments made by three generations of the Sax family marks the bicentenary of the birth of Adolphe Sax. Rare saxophones, brass instruments, and an exquisite ivory clarinet are among the twenty-six instruments selected to showcase the inventions and innovations of this important family.
There are few instrument makers who have become a household name. The eponymous instruments of Adolphe Sax have had a wide-reaching impact on music and society. Patented in 1846 and conceived as a military band and orchestral instrument, the saxophone is now integral to many different types of music around the world. Through jazz and pop, it achieved the type of universal popularity matched by few other instruments. During Sax's life, military and band music were transformed by saxhorns, his innovative family of brass instruments. The saxhorn fueled the brass band movement, which opened up music making to the working classes. Modern day euphoniums, tenor horns, and baritones are all descendants of the saxhorn family. 
The bicentenary of Adolphe Sax's birth also marks the 125th anniversary of the gift of over 3,600 instruments to the Met by the pioneering collector Mary Elizabeth Adams Brown. Sax was also an avid collector, active during a formative period of musical instrument scholarship. Many important instrument collections were established during his lifetime, including the one at the Metropolitan Museum. Sax and Brown circulated in the same international community of scholars and collectors, and instruments made by the Sax family featured prominently in Brown's collection as examples of cutting-edge instrument design. They continue to inspire performers, composers, and instrument makers.
00312,This exhibition reveals the most sumptuous moment in late nineteenth-century America—a period known as the Gilded Age—through the work of some of the most noted design firms at the time. The centerpiece of the three-part exhibition is the opulent Worsham-Rockefeller Dressing Room from the New York City house commissioned by art collector and philanthropist Arabella Worsham (later Huntington; ca. 1850–1924). A complete work of art, with its elaborate woodwork and decorations, it is a rare surviving commission by the New York–based cabinetmaker and interior decorator George A. Schastey (American, 1839–1894).
Although little known today, Schastey operated a large and successful decorating firm in the late nineteenth century, catering to some of the nation's wealthiest individuals. Loans from public and private collections will highlight his work and important role; some of these works are newly attributed to him and have never before been on public view. The exhibition will also include furniture by some of Schastey's contemporaries.
An adjoining gallery will display works by Schastey's best-known competitor, Herter Brothers, that were created for the firm's most important commission, the William H. Vanderbilt House. In total, the exhibition will include more than three dozen examples of furniture from America's Gilded Age. Visitors will gain new insights into the luxurious and artistic interiors found in New York's wealthiest households in the late nineteenth century.
00321,In the early 20th century, the arts of medieval Iran and Syria attracted unprecedented interest in the West. Demand by museums and collectors—especially for figural and highly decorated works—promoted commercial and research excavations, and led to the custom of repairing, filling in, and enhancing fragmentary and deteriorated examples.
The exhibition will consider the legacy of such practices 100 years later, as it compares archaeological artifacts with those that were refurbished, forged, or imitated.
00323,This exhibition features eight quilts—all recent additions to the Museum's outstanding quilt collection, only one of which has been shown at the Museum before. The display also includes a selection of folk painting and furniture from The American Wing's collection, as well as two important paintings by Edward Hicks (American, 1780–1840), on loan from the Peter J. Solomon Family Collection.
The current group of quilts will remain on view through January 8, 2016, at which time a new selection of quilts will be installed. The second rotation will be displayed through August 7, 2016.
