ex_id,desc
00309,This installation of drawings, prints, and related ephemera by the German artist and performer Matthias Buchinger (1674–1739) explores for the first time the oeuvre of the so-called Little Man of Nuremberg. Standing only twenty-nine inches high, and born without hands or feet, Buchinger was celebrated in his own time as a draftsman and calligrapher as well as a magician and musician. He boasted a clientele that included noblemen, kings, and emperors, along with members of the public who visited him at inns and fairs from Leipzig to Paris and from London to Belfast.
Buchinger's remarkably delicate drawings often exploited flowing lines of microscopic texts to build up figures and elaborate scenes, an ancient Jewish technique known as micrography. The vast majority also incorporate calligraphic inscriptions that describe his physical condition as well as his artistic and personal triumphs. His main subjects include family trees, coats of arms, the Ten Commandments, and portraits. The works on display are drawn primarily from the collection of the master conjurer and author Ricky Jay. Framing them are works on paper from the Met's collection, dating from the late Middle Ages to the present day, that artfully play with words or typography.
00306,This installation, the thirteenth since the Joyce and Robert Menschel Hall for Modern Photography opened in 2007, is a snapshot—not comprehensive, but representative—of the collecting interests of the Department of Photographs through recently acquired works made by fifteen artists over the last seven years. While the title is taken from a photograph in the exhibition, the concept of reconstruction chimes with many of the works, which can be viewed, at least in part, as indirect addresses to how perception and cognition are being remapped to accommodate our newly bifurcated existences—online and "in real life."
The notion that we swim in a sea of photographic images that shape how we see ourselves and the world felt new in 1989 and prescient in 1968, but with the rise of the Internet and social media, this condition is so obvious as to be useless. With one foot in cyberspace and the other on an unstable terrain of accelerated change, our daily life and deepest subjective recesses—our relationship to ourselves, each other, and to things—is constantly being reconstructed along digital lines, with cameras serving as almost bodily appendages to interface between these two realities. In this context, the seamless digital “restoration” of dazzle camouflage to a WWII battleship, the viral spread of Photoshop mishaps in an interior view, or the simple folding back of a book page can be seen as complex negotiations between the old order and the new networks that silently and invisibly are shaping individual and collective experience.
00307,When the Department of Far Eastern Art was established at the Metropolitan in the summer of 1915, the Museum possessed only sixty-five Korean works. Some were mistakenly catalogued as Chinese or Japanese. Dubbed the "hermit kingdom," Korea was then little known to the Western world. Today, its traditional arts, as well as pop music, film, and drama, are celebrated markers of global culture. The Museum's collection of Korean art, too, has been significantly transformed and continues to evolve. It now encompasses ceramics, paintings, sculpture, metalwork, lacquer ware, and textiles from the late Bronze Age to the present. 
Works on view include important recent gifts to the Museum from the Mary Griggs Burke Collection and Florence and Irving Collection—including a rare sixteenth-century Buddhist painting of royal commission, a striking mid-seventeenth-century gilt-wood statue of a Bodhisattva, and exquisite mother-of-pearl inlaid lacquer boxes from the Joseon dynasty (1392–1910). The stories behind the objects in this exhibition capture the individuals and trends that shaped the Met's distinctive collection, sometimes deliberately, sometimes accidentally. This presentation also reveals the modern Western imagination of Korea, and the many ways Korean art came to be viewed and appreciated in America.
00336,This exhibition will illuminate the key role that the Holy City played in shaping the art of the period from 1000 to 1400. While Jerusalem is often described as a city of three faiths, that formulation underestimates its fascinating complexity. In fact, the city was home to multiple cultures, faiths, and languages. History records harmonious and dissonant voices from many lands. Persians, Turks, Greeks, Syrians, Armenians, Georgians, Copts, Ethiopians, Indians, and Europeans passed in the narrow streets of a city not much larger than midtown Manhattan. This will be the first exhibition to unravel the various cultural traditions and aesthetic strands that enriched and enlivened the medieval city.
Over two hundred works of art will be gathered from some sixty lenders worldwide. Nearly a quarter of the objects will come from Jerusalem. Among these are key loans from the city's many religious communities, some of which have never before shared their treasures outside their walls. Every People Under Heaven will bear witness to the crucial role that Jerusalem has played in shaping world culture, a lesson vital to our common history.
00329,The Metropolitan's collection of Nepalese and Tibetan art has recently been transformed by a series of major gifts. This installation features both promised and recently gifted works that are now integrated into the newly refurbished galleries—including an important twelfth-century Tibetan bronze Padmapani, a thirteenth-century bronze Vajravarahi, an important sixteenth-century Tibetan Hevajra mandala tangka, and a spectacular brass stupa (chorten). The Nepalese Gallery has been enriched by a large polychromed wood sculpture of the Goddess of Dance (Nrtyadevi). These works reflect the generosity of Steve and Sharon Davies, Florence and Herbert Irving, Ann and Gilbert Kinney, and the Zimmerman family.
00320,This exhibition, mounted in celebration of gifts both donated and promised to the Met, gathers works by Alex Katz (American, born 1927), one of our era's most acclaimed artists. Acquired through the generosity of Glenn Fuhrman, Leonard A. Lauder, and Katz himself, these works—eight in total, including two loans—span nearly the entire arc of Katz's career and include drawings, prints, and paintings. Among the works are two cutouts, the innovative artistic device that Katz pioneered in the late 1950s; a haunting cityscape; several portraits of Ada, Katz's wife and long-time muse; and portraits of luminaries from Katz's own social and artistic circles. 
Katz was born in Brooklyn in 1927 and came of age as an artist during the heyday of the New York School. In the late 1950s, he began to develop his mature style, one characterized by elegance, simplicity, and stylized abstraction. Committed to depicting recognizable motifs, Katz minimizes details and shading, choosing instead to summarize his subjects with the help of bold contours, blocks of color, and strategic swipes of the brush. As much as they represent a specific person or place, Katz's works also depict the act of seeing itself—that is, the peculiar mechanics of viewing, whether from afar or close up, whether on an empty street or across a crowded room. He captures the surprise and suspense, the desire and pleasure, that accompany the experience of spectatorship.
00308,Time is all around us, displayed on our phones and computers. Today, almost nobody needs to own a watch or a clock to tell the time. Access to the right time is not the luxury it once was. Yet the fascination with clocks and watches persists, and the thriving market for mechanical timekeepers is deeply aware of their history. Clocks and watches have always been about more than just telling time: they have been treasured as objects of desire and wonder, personal items imbued with value that goes beyond pure functionality. As works of art, they represent the marriage of innovation and craftsmanship.
This exhibition explores the relationship between the artistry of the exterior form of European timekeepers and the brilliantly conceived technology that they contain. Drawn from the Museum's distinguished collection of German, French, English, and Swiss horology from the sixteenth through the nineteenth century, the extraordinary objects on view show how clocks and watches were made into lavish furniture or exquisite jewelry. 
The creation of timekeepers required that clockmakers work with cabinetmakers, goldsmiths and silversmiths, enamelers, chasers and gilders, engravers, and even those working in sculpture and porcelain. These craftsmen were tasked with accommodating internal mechanisms by producing cases that, in both shape and function, adapted to timekeeping technologies. Their exteriors are often as complicated as the movements they house. Examining the dialogue between inside and out, adornment and ingenuity, The Luxury of Time reveals the complex evolution of European clockmaking and the central place of timekeepers in the history of decorative arts.
00311,This focus exhibition presents the findings of a recent study of the Crucifixion and Last Judgment paintings (ca. 1440–41) by Jan van Eyck and his workshop. These paintings and their frames have undergone technical investigations in an effort to solve long-standing mysteries about them. Whether the paintings were always intended as a diptych, or whether they were originally the wings of a triptych or the doors of a tabernacle, has been in question. The answer may be found not only in a closer look at the frames, but also in the relationship of the Metropolitan's Crucifixion painting to a recently rediscovered drawing of the Crucifixion attributed to Jan van Eyck (ca. 1390–1441) that has been acquired by the Boijmans Van Beuningen Museum in Rotterdam, and is also on view in the exhibition.
New infrared reflectography now affords an opportunity to compare the underdrawings of the Crucifixion and Last Judgment paintings with the Rotterdam drawing. In addition, X-radiography of the paintings' frames has revealed another text, albeit very damaged and fragmentary, on the flat part of the frame beneath the gold overpaint. The text is in Flemish, in Gothic miniscule script, as opposed to the Latin pastiglia (raised lettering) on the interior cove of the two frames. This introduces new clues regarding the original form and function of the two paintings, as the exhibition demonstrates.
00334,One of the most productive periods in the history of the region from Iran to Anatolia (Turkey) corresponds to the rule of the Seljuqs and their immediate successors, from 1038 to 1307. The Seljuqs were a Turkic dynasty of Central Asian nomadic origin that in short time conquered a vast territory in West Asia stretching from present-day Turkmenistan, Iran, Iraq, Syria, and Turkey. The lands controlled by the Seljuqs were not a unified empire, but controlled by various branches of the Seljuqs and their successor dynasties (Rum Seljuqs, Artuqids, Zangids, and others). Under Seljuq rule, the exchange and synthesis of diverse traditions—including Turkmen, Perso-Arabo-Islamic, Byzantine, Armenian, Crusader, and other Christian cultures—accompanied economic prosperity, advances in science and technology, and a great flowering of culture within the realm.
This landmark international loan exhibition will feature spectacular works of art created in the eleventh through thirteenth century from Turkmenistan to the Mediterranean. Approximately 270 objects—including ceramics, glass, stucco, works on paper, woodwork, textiles, and metalwork—from American, European, and Middle Eastern public and private collections will be shown. Many of the institutions have never lent works from their collections before. Among the highlights will be a dozen important loans from Turkmenistan, marking the first time that Turkmenistan as an independent country has permitted an extended loan of a group of objects to a museum in the United States.
Under the Great Seljuqs of Iran, the middle class prospered, spurring arts patronage, technological advancements, and a market for luxury goods. In contrast, in Anatolia and the Jazira (northwestern Iraq, northeastern Syria, and southeastern Turkey)—which were controlled by the Seljuq successor dynasties—art was produced under royal patronage, and Islamic iconography was introduced to a predominantly Christian area.
Furthermore, a number of artists had immigrated to the region from Iran in response to the Mongol conquest in 1220. Because patrons, consumers, and artists came from diverse cultural, religious, and artistic backgrounds, distinctive arts were produced and flourished in the western parts of the Seljuq realm.
00330,This tribute to a great collector reveals the distinctive features of Japanese art as viewed through the lens of fifty years of collecting: the sublime spirituality of Buddhist and Shinto art; the boldness of Zen ink painting; the imaginary world conjured up by the Tale of Genji and classical Japanese literature; the sumptuous colors of bird-and-flower painting; the subtlety of poetry, calligraphy, and literati themes; the aestheticized accoutrements of the tea ceremony; and the charming portraiture of courtesans from the "floating world" (ukiyo-e).
00317,Heber R. Bishop's collection of carved jades was formed in the last quarter of the nineteenth century and bequeathed to the Metropolitan Museum in 1902. Consisting of over one thousand pieces—primarily Chinese jades of the eighteenth and nineteenth centuries, as well as jades from Mughal India—it was the first major collection of its kind in the country. This exhibition features a selection of the finest examples from this renowned collection and celebrates the hundredth anniversary of the Department of Asian Art.
00319,This installation, which explores the cultural importance of silk in China, showcases the most important and unusual textiles from the Museum's collection. In addition to three rare pieces dating from the Tang dynasty (618–906), when China served as a cultural hub linking Korea and Japan to Central and West Asia, and ultimately to the Mediterranean world, the exhibition also includes eleventh- and twelfth-century tapestries from Central Asia, as well as contemporaneous Chinese examples of this technique.
Spectacular embroideries—including an imperial fourteenth-century canopy decorated with phoenixes and flowers, and a monumental late seventeenth- or early eighteenth-century panel showing phoenixes in a garden—are also on view, together with theatrical garments, court costumes, and early examples of badges worn at court to designate rank.
00331,This exhibition addresses a subject critical to artistic practice: the question of when a work of art is finished. Beginning with the Renaissance masters, this scholarly and innovative exhibition examines the term "unfinished" in its broadest possible sense, including works left incomplete by their makers, which often give insight into the process of their creation, but also those that partake of a non finito—intentionally unfinished—aesthetic that embraces the unresolved and open-ended. Some of history's greatest artists explored such an aesthetic, among them Titian, Rembrandt, Turner, and Cézanne.
The unfinished has been taken in entirely new directions by modern and contemporary artists, among them Janine Antoni, Lygia Clark, Jackson Pollock, and Robert Rauschenberg, who alternately blurred the distinction between making and un-making, extended the boundaries of art into both space and time, and recruited viewers to complete the objects they had begun.
Comprising 197 works dating from the Renaissance to the present—approximately forty percent of which are drawn from the Museum's own collection, enhanced by major national and international loans—this exhibition demonstrates The Met's unique capacity to mine its rich collection and scholarly resources to present modern and contemporary art within a deep historical context.
00315,"Prints throw open to their students with the most complete abandon the whole gamut of human life and endeavor, from the most ephemeral of courtesies to the loftiest pictorial presentation of man's spiritual aspirations." —William M. Ivins
This exhibition commemorates the centenary of the Department of Prints at The Metropolitan Museum of Art by celebrating the astounding legacy of its founding curator, William Mills Ivins, and his brilliant protégé A. Hyatt Mayor. Together, during their combined fifty-year tenure, Ivins and Mayor amassed a collection of many hundreds of thousands of prints that is both encyclopedic in its scope and studied in its many areas of focus.
By drawing on its own vast holdings, this exhibition reveals how the Met's print collection was artfully constructed according to the vision of Ivins and Mayor—both social historians and amateur print specialists. The exhibition will show how the print collection of the Museum was meant to be like a library, composed from the beginning as a corpus of works (not all distinctly masterful works of art) that describe, in the most comprehensive way, man's aspirations. It will display the most beautiful, rare, and exceptional prints alongside the equally important popular and ephemeral works that were collected in the first fifty years of the department's history. The exhibition tells the story of this great American collection through prints by Andrea Mantegna, Marcantonio Raimondi, Albrecht Dürer, Rembrandt van Rijn, Jacques Callot, Francisco de Goya, James McNeill Whistler, Mary Cassatt, Edward Hopper, Honoré Daumier, Edward Penfield, and Henri de Toulouse-Lautrec, to name just a few artists in the exhibition.
The Power of Prints explores how the evolution of curatorial priorities—notably from purely aesthetic concerns to those of content and context—affected the building of the department's remarkable stock of etchings and engravings. The exhibition also, like Ivins and Mayor, approaches printed matter as the first entrée into the information age, as functional objects that were meant to spread information to an ever-widening public and, in turn, to reflect the changing aspects of any given society.
00332,One of the most significant artists to emerge in post-Independence India, Nasreen Mohamedi (1937–1990) created a body of work that demonstrates a singular and sustained engagement with abstraction. Her minimalist practice not only adds a rich layer to the history of South Asian art but also necessitates an expansion of the narratives of international modernism. The Met Breuer exhibition, the first museum retrospective of the artist's work in the United States, is an important part of the Met's initiative to explore and present the global scope of modern and contemporary art.
Mohamedi mainly worked with gestures of pencil and ink on paper, experimenting with organic forms, delicate grids, and dynamic, hard-edged lines. Her cosmopolitan outlook enabled her to draw upon a range of aesthetic sensibilities, from the poetry of Rilke and Camus, as well as Indian classical music, to the modernist architecture of Le Corbusier's Chandigarh.
Spanning Mohamedi's entire career and bringing together more than 130 paintings, drawings, photographs, and rarely seen diaries, the exhibition traces the conceptual complexity and visual subtlety of the artist's oeuvre.
00328,Sol LeWitt (American, 1928–2007) executed drawings by hand throughout his life; in 1968 he extricated his work from the confines of the frame and transferred it directly to the wall. The wall compositions were designed for limited duration and maximum flexibility within a broad range of architectural settings. Initially executed by drafters, these works in their finished state were most often slated for destruction. A seminal practitioner of Conceptual Art, LeWitt emphasized the creative idea that generates a work of art, as opposed to the work's material existence. "For each work of art that becomes physical," he wrote, "there are many variations that do not."
Sol LeWitt's 1982 Wall Drawing #370: Ten Geometric Figures (including right triangle, cross, X, diamond) with three-inch parallel bands of lines in two directions was installed at the Museum over a period of four weeks. The drawing (a detail of which is at left) will be on view in its complete state through January 1, 2017, when it will be painted over.
00316,Dramas presented during religious festivals in southern India are an important aspect of popular Hindu celebration. This exhibition highlights five rare wooden sculptural masks that represent a largely unrecorded category of late medieval Indian devotional art. The masks depict the protagonists in a deadly battle between Vishnu in his man-lion avatar, Narasimha, and an evil king whose destruction was essential for the restoration of order in the universe.
00313,The Burdick baseball card collection constitutes an integral part of The Metropolitan Museum of Art's collection of ephemera and tells the history of popular printmaking in the United States. In 1947, after having approached A. Hyatt Mayor, the Museum's curator of prints and photographs, the Syracuse electrician Jefferson R. Burdick (1900–1963) began to donate his entire collection of approximately thirty thousand baseball cards in large batches, along with another 270,000 trade and postcards, to the Museum.
The baseball cards collected by Burdick date from 1887 to 1959 and represent the most comprehensive collection outside of the Baseball Hall of Fame in Cooperstown, New York. The cards on view illustrate the history of baseball from the dead-ball era at the turn of the nineteenth century through the golden age and modern era of the sport.
The baseball cards document the sport through various types of media—from lithography to photography—and imagery illustrating legends as well as the lesser-known players, owners, and teams that have contributed to the history of the game.
00305,Throughout her career, South African photographer Jo Ractliffe (born 1961) has directed her camera toward landscapes to address themes of displacement, conflict, history, memory, and erasure. This exhibition brings together selected works from three of her recent photographic series that focus on the aftermath of the Angolan Civil War (1975–2002) and its relationship with the Border War (1966–89) fought by South Africans in Angola and present-day Namibia. For Ractliffe and many other South African civilians, Angola during these wars was an abstract place, a "secret, unspoken location where brothers and boyfriends were sent as part of their military service." When seen consecutively, these three series reveal Ractliffe's deepening engagement with the region's complex histories as an attempt to "retrieve a place for memory."
The earliest series, Terreno Ocupado (2007–8), was produced during Ractliffe's first visit to Angola's capital, Luanda, five years after the end of the Civil War. These images highlight the structural instability of the capital's shantytowns and question what it means for land to be occupied, abandoned, and struggled over. While working on As Terras do Fim do Mundo (2009–10), Ractliffe traveled alongside ex-soldiers returning to the desolate places in the Angolan countryside where they had fought. The Borderlands (2011–13) examines the impact of the wars in Angola within South Africa's borders. For this most recent project, she photographed militarized landscapes that had been occupied by the South African army, tracing histories of displacement that began during the colonial and apartheid periods and continue to unfold today.
The photographs in all three series were originally produced as either gelatin silver prints or archival pigment prints on cotton paper; the inkjet prints on display here were made by the artist specially for this exhibition.
This exhibition has been organized to coincide with Kongo: Power and Majesty, which focuses on works created by artists in present-day Angola between the sixteenth and nineteenth centuries.
00303,From the first millennium B.C. until the arrival of Europeans in the sixteenth century, artists from the ancient Americas created small-scale architectural models to be placed in the tombs of important individuals. These works in stone, ceramic, wood, and metal range from highly abstracted, minimalist representations of temples and houses to elaborate architectural complexes populated with figures. Such miniature structures were critical components in funerary practice and beliefs about an afterlife, and they convey a rich sense of ancient ritual as well as the daily lives of the Aztecs, the Incas, and their predecessors.
This exhibition, the first of its kind in the United States, sheds light on the role of these objects in mediating relationships between the living, the dead, and the divine. It also provides a rare look at ancient American architecture, much of which did not survive to the present day. Some thirty remarkable loans from museums in the United States and Peru join works from the Metropolitan Museum's permanent collection, which is particularly rich in this material.

Related Travel with the Met Trip
Ancient Civilizations of Peru (April 29–May 10, 2016)
Experience the mystery and pageantry of Peru, home to five millennia of history, with exhibition curator Joanne Pillsbury.

Met Blogs Series
Read blog posts related to this exhibition on Now at the Met.
