ex_id,desc
00105,In Nothing Personal, works by three American artists come together in a show about the passage from personhood to persona.
The 82 photographs that make up The Fae Richards Archive provide a convincing record of a person who never existed. Fae Richards could have been an actress and singer who worked from the 1920s to the 1970s. She was black, gay, and talented, and she achieved success to the degree that circumstances permitted. Zoe Leonard meticulously prepared a mix of publicity shots, film stills, and personal photos to create this fictional archive. She researched historically appropriate photographic papers, and “cast” different printers as well, to guard against a uniform look. The results show happiness tinged with melancholy and ask us to think about what it means to go through life behaving as a credible facsimile.
The 70 black-and-white photographs in Cindy Sherman’s series Untitled Film Stills constitute a major contribution to contemporary art. At 8 × 10 inches, Sherman’s prints look like ordinary film stills: publicity images that stage scenes from a movie for press and other promotional uses. In fact, Sherman did not re-create any specific character or movie. Her one-person show, modeled mainly on European art-house cinema, features a range of postwar genres and female roles that the artist inhabits like a shadow. “The characters weren’t just airhead actresses,” Sherman has said. “The clothes make them seem a certain way, but then you look at their expression and wonder if maybe ‘they’ are not what the clothes are communicating.”
Lorna Simpson’s fifth video work, Corridor, compares two historical periods: the mid-19th and the mid-20th centuries. Two characters, each alone in her domestic world, bring these moments to life, moving in parallel or in tandem through their respective daily routines. One appears to be a household servant or freed slave from around 1860, the other a successful homeowner living one century later—yet both are played by a single person, the artist Wangechi Mutu. The soundtrack, composed by John Davis, similarly contrasts a variety of musical sources, including echoes of “The Battle Hymn of the Republic,” Chopinesque piano, New Orleans dirges, and free jazz. Using sounds instead of words, the two characters—who are and are not the same woman—carry on a dialogue across the divide of time and circumstance.
Sponsors
Generous in-kind support for this exhibition is provided by Tru Vue, Inc. and Gemini Moulding, Inc.

00106,The School of the Art Institute (SAIC) and the Art Institute of Chicago museum have long shared a symbiotic relationship—one institution training artists and the other establishing an encyclopedic collection of works of art for artists and the public alike to study and enjoy. Since the Art Institute’s earliest days, students have enjoyed spending class time in the galleries and have found inspiration in the museum’s collection. Today, the museum is fortunate to count a great deal of works by SAIC alumni among its holdings.
To celebrate the long association between the museum and the school, Homegrown features approximately 120 objects, primarily works on paper, from the Art Institute’s collection made by artists who attended SAIC. Beginning with the early 20th century and organized by decade, the display presents works by some of the most illustrious SAIC-educated artists while also prominently featuring pieces by those whose tenure at the school has at times been overlooked. Highlights include 20 iconic self-portraits by Ivan Albright (1897–1983), created at the end his career using a variety of drawing and painting media, and a selection of color woodblock prints by Gustave Baumann (1881–1971), a Santa Fe–based artist, designer, and letterpress printer who studied at SAIC as a teenager. Also included are the sketchbooks of Margo Hoff and LeRoy Neiman; Neiman’s drawings of Chicago’s Oak Street Beach, in particular, showcase the glitterati of a period typified by Hugh Hefner’s founding of Playboy in the city in 1953. Pieces by the so-called Monster Roster artists who matured in the late-1940s and early 1950s—including Cosmo Campoli, Leon Golub, and Nancy Spero—and Imagist and Hairy Who artists such as Gladys Nilsson, Suellen Rocca, Sarah Canright, and Christina Ramberg, along with a variety of more recent works, round out the selections. Nilsson’s Big School Picture; Little Paper Mural, commissioned by SAIC to be used as a poster advertising the school, serves as a particularly witty, beautiful example of the artist’s work in its maturity.
That the school has produced such a range and wealth of talented artists over the years and that the museum has been able to acquire so much of this work to share are truly causes for celebration. The Art Institute of Chicago invites you to experience and explore the best of Chicago’s very own—works by artists “homegrown” here on Michigan Avenue.

00111,While the Art Institute has a long tradition of collecting and displaying works from the pre-Hispanic cultures of South America, this long-term installation offers the museum’s first presentation of work from the viceregal period. Fourteen paintings and related works on paper—including pieces from the collection of Chicagoans Marilynn and Carl Thoma never before displayed in a museum, as well as important loans from the Newberry Library and Denver Art Museum—introduce visitors to explorers, artists, and patrons who lived in the Spanish-governed Andes during the 17th, 18th, and 19th centuries.
The metaphorical guide of this journey is Antonio de Ulloa (1716–95), a Spanish naval officer and cartographer who traveled to South America with a French scientific mission in the 1730s and 1740s. His portrait introduces the group of works assembled—paintings of identified sitters, signal works by important South American artists, and devotional paintings that include historical figures. Each work has its own direct link to individual biography and lived experience in the New World, offering a more personal look at the themes of exploration and discovery and bringing to life the culture and artistic production in South America as European conventions combined with indigenous traditions.
The installation is accompanied by a bilingual brochure as well as bilingual treatment of all object labels, wall texts, and audio guide stops. Select works have also been added to the museum’s “Closer” app, featuring slide shows, videos, archival materials, and more for further insight into this unique period of cultural convergence.
Download the Closer app, available for iOS devices.

SponsorsMajor funding has been provided by the Old Masters Society, whose generosity has enabled innovative projects at the Art Institute for many decades.
Digital Engagement supported by

00108,Alfred Stieglitz (American, 1864–1946) tirelessly promoted photography as a fine art. Through his own photographic work over the course of a half-century, the photographic journals he edited and published, and the New York galleries at which he organized exhibitions of photographs, paintings, and sculpture, Stieglitz showed photography to be an integral part of modern art in America. In a search for artistic ancestors, he looked intently at photography of the 19th century, most notably that of Julia Margaret Cameron and the Scottish duo David Octavius Hill and Robert Adamson. Their work resonated for Pictorialism, a movement that valued painterly, handcrafted images, and these earlier photographs were exhibited and reprinted for new audiences. Stieglitz’s fledgling interest to create a history of photography as an art form was also evidenced in his decision, later in his career, to revisit his own prior output, reprinting earlier images in a high modernist style.

The Stieglitz collection at the Art Institute includes several later Cameron and Hill and Adamson prints along with important works by Stieglitz himself, Edward Steichen, and other Pictorialist artists. Drawn entirely from the permanent collection, this exhibition examines how 19th-century photographs influenced Pictorialist practice. Fostering close looking at different photographic processes—from salt and albumen prints of the 19th century, to carbon prints and photogravures of turn-of-the-century reproduction, to crisp gelatin silver prints of the modernist period—it shows Stieglitz and his circle in the context of a changing photographic history.



Related MediaLearn more with this glossary of photographic printing processes.




SponsorsLead support for the exhibition is provided by the Black Dog Fund. Additional support has been contributed by the Stuart Family Fund.
00104,Of all the Impressionists who focused on modern life, Edgar Degas was the most dedicated to the classical tradition of depicting the human form, especially that form in movement and performance. In this focused exhibition, two exceptional loans—a remarkable painting from the National Gallery of Art, Washington, D.C., Scene from the Steeplechase: The Fallen Jockey, and a beloved sculpture from a private Chicago collection, Little Dancer Aged Fourteen—join other loans and paintings, drawings, pastels, and sculpture from the Art Institute’s permanent collection to explore the artist’s career-long fascination with the figure in motion through the subjects of the racetrack and ballet.
A striking canvas, Degas’s Scene from the Steeplechase: The Fallen Jockey marked a momentous transition for the artist from the classically inspired history paintings of his youth toward the depiction of subjects drawn from modern life. In the mid-1860s, when Degas premiered this work, the cross-country obstacle race known as the steeplechase had reached the height of its popularity, but the sport’s potential for danger also made it controversial. This highly dramatic image, possibly inspired by a recent tragedy, underscores the perils inherent to the race. Painted on a public scale, it nevertheless captures an intimate and unsettling moment. Is the jockey, for which Degas’s younger brother Achille served as the model, dead or merely fallen? The sense of immediacy evoked by the painting contrasts sharply with the artist’s own working method for the piece, which was complex and painstaking; Degas returned to the work over the course of nearly 30 years radically reworking both subject and brushwork. He reportedly deemed the painting “one of those works which are sold after a man’s death. . . . Artists buy them not caring whether they are finished or not.”
Degas’s fascination with Parisian cultural life extended also to the café concert, theatrical performances, and above all, the ballet. Like the steeplechase, the ballet existed to entertain the wealthy, and the artist paid for the privilege of going behind the scenes of the ballerina’s world. This intimate vantage point allowed him to capture what fascinated him most: the movement of the performer—caught in the poetry of the onstage illusion or backstage practice. That poetry is highlighted in this presentation by Little Dancer Aged Fourteen, a bronze cast from the original wax sculpture displayed at the sixth Impressionist exhibition in 1881. With her feet turned out, shoulders pressed down and back, and chin lifted high, her body brims with energy. That grace and athleticism, physical peril and transport—whether through the form of a young dancer, a robust singer, or a daring rider—come alive in the works selected for this intimate exhibition.
SponsorDegas: At the Track, On the Stage is made possible by Louise S. Hart.

00115,When Vincent van Gogh decided to become an artist at the age of 27, he had already lived in 16 cities and had failed at five different professions. Though finally settled in his career, his home life was anything but—Van Gogh remained a wanderer until his death 10 years later, despite his dream of a permanent home. With each move, the change in environment took his artistic aesthetic in a new direction. 
To complement the exhibition Van Gogh’s Bedrooms, which explores the theme of home in the artist’s oeuvre, the Ryerson and Burnham Libraries present Van Gogh: In Search Of, a focused exhibition featuring photographs of the many residences and locales Van Gogh frequented over the course of his artistic career. 
The selection of images, drawn largely from the libraries’ own archives, were made possible by a friendship established between the Art Institute and the Van Gogh family in the 1940s. While preparing for a Van Gogh exhibition at the museum in 1949, Art Institute Director Daniel Catton Rich and Public Relations Counsel Peter Pollack visited the artist’s nephew, Vincent Willem van Gogh, to ask for a loan of many of his uncle's paintings for the show. A close friendship among the men developed, and the three of them set out to visit most of the sites captured by the famous artist in his fabulous paintings. These site visits were documented by Pollack, a trained photographer. This remarkable assemblage of images offers a unique glimpse into the artist's life seen through the lens of the photographer.
Please note: this exhibition is open on weekdays only. 

00103,One of the most renowned artists working today, Martin Puryear is celebrated for his elegant but playful sculpture and his devotion to craft. Lesser known is the extensive iterative process of drawing and printmaking that is essential to the artist’s studio practice. This exhibition is the first to draw back the curtain on that practice. Featuring over 100 drawings and prints as well as 12 sculptures—many borrowed directly from the artist and never displayed before—the presentation offers an unprecedented look into Puryear’s inspirations, methods, and transformative process.Martin Puryear has had a long relationship with Chicago and the Art Institute. He lived in the city for 12 years,  and the museum has long been supportive of his work—acquiring key pieces in the 1980s, organizing an extensive survey in 1991, and conserving many of his fire-damaged early prints and drawings after that show. Puryear has responded in kind, giving the museum a double-sided drawing for his sculpture Sanctuary and participating  generously and closely in the development of this exhibition, including loaning many works that he has never shared publicly before.Uniting these rarely seen drawings, several sculptures, and selections from his sketchbooks, Martin Puryear: Multiple Dimensions traces the artist’s career from his student days at Catholic University in the early 1960s through the present, with works created as recently as 2014. Critical to Puryear’s development were his formative years spent with the Peace Corps in Sierra Leone (1964–1966), a period in which he was inspired by and gave expression to buildings, flora, insects, animals, and children—the entirety of his environment. Since then, Puryear has returned to many of these themes, experimenting with scale, materials, and varying levels of abstraction. In the exhibition, visitors can witness  this evolution of thought—how a sketch of a house in Sierra Leone is transformed 10 years later into an abstracted proto-sculptural form, or how a head-like shape is reworked in bronze, wood, black Conté crayon, and graphite.By bringing to life the artist’s uncanny ability to make forms that are suggestive, playful, and transformative, all while remaining anchored in the world, this display of Puryear’s explorations across visual ideas and media offers a 360-degree view of the creative process of a contemporary master.
Sponsors
Martin Puryear: Multiple Dimensions is organized by the Art Institute of Chicago.
Support for the exhibition is provided by the Morton International Exhibition Fund and the Kemper Educational and Charitable Fund.
Annual support for Art Institute exhibitions is provided by the Exhibitions Trust: Kenneth Griffin, Robert M. and Diane v.S. Levy, Thomas and Margot Pritzker, Betsy Bergman Rosenfield and Andrew M. Rosenfield, the Earl and Brenda Shapiro Foundation, and the Woman’s Board.

00112,The 1909 Plan of Chicago played a major role in the global history of urban planning and remains one of the largest and most comprehensive proposals for the transformation of an American city. Authored by architects Daniel H. Burnham and Edward H. Bennett with a committee of advisors from the Commercial Club of Chicago, the plan addressed issues common to many urban centers of this era, including insufficient infrastructure, the need for accessible green space, troubled class relations, and the lack of a strong civic image and identity for the city of Chicago.
The visual language of the plan has played a large role in its enduring legacy, including, most notably, a series of monumental watercolors created by the American artist and illustrator Jules Guérin. From Guérin’s sweeping bird’s-eye views of the city center and lakefront to maps proposing a commanding new geometry for Chicago’s urban fabric, the plan’s images constitute a powerful pictorial narrative about the nature and goals of urban change. Ultimately, the Plan of Chicago communicated the authors’ belief in the power of order and beauty to transform the everyday lives of Chicago residents, and by extension, all American citizens.

00102,This past December, we reopened our galleries of contemporary art, unveiling the largest gift in the Art Institute’s 136-year history: 44 iconic works by artists such as Andy Warhol, Roy Lichtenstein, and Jasper Johns. Generously donated by Chicago collectors Stefan Edlis and Gael Neeson, these 44 paintings, sculptures, and photographs transform the museum’s presentation of contemporary art, bringing new depth and perspective to the Art Institute’s already strong holdings and making this collection the strongest of any encyclopedic art museum in the world.

The Art Institute has been committed to collecting and exhibiting contemporary art since the museum’s founding in the 19th century, when Impressionism was considered “contemporary.” Our rich collections today are largely the result of the generosity and vision of private collectors who have chosen to become great benefactors, and the Edlis/Neeson gift is the latest chapter in this long legacy of patronage and support.
Their gift charts the course of the most adventurous art movements since the 1950s, primarily in the United States, beginning with the work of Jasper Johns, Robert Rauschenberg, and Cy Twombly, who began to forge a path out of Abstract Expressionism toward Pop Art with the use of images, materials, and techniques from mass media and found objects. Pop itself is represented in the gift by a landmark group of works by Andy Warhol—including two self-portraits—and signature works by Roy Lichtenstein. The collection also chronicles the significant and enduring influence of Pop Art on later generations of artists, including the virtuouso painter Gerhard Richter, the photography-based critiques of Richard Prince and Cindy Sherman, and the pop-culture riffs of Katharina Fritsch, Jeff Koons, and Takashi Murakami.
The Art Institute is a collection of collections, each compelling on its own terms yet capable of telling richer, more extraordinary stories when brought into dialogue. To be sure, the Art Institute of Chicago—and the stories we tell—have been made far greater by Stefan Edlis and Gael Neeson’s gift, an extraordinary benefaction to the city, and, indeed, to the world.

00110,The Art Institute’s Department of Textiles is fortunate to own a large collection, some 200 in all, of kesa, the rectangular or trapezoidal outer garment traditionally worn by Buddhist monks and priests in Japan. The textiles have been mostly acquired over the years by donations from various private collectors, but the largest group and many of the most significant pieces came from the collection of Ralph and Mary Hays in 2004. Although a few examples of our kesa have been displayed in the past, this is the first exhibition at the Art Institute to present an overview of this distinctive group of textiles.
Often described as a mantle or robe, the kesa is worn draped diagonally over the left shoulder and under the right armpit. The Japanese term kesa derives from the Sanskrit word kasaya (or turbulence, an allusion to the dyeing process) and indicates the garment’s Indian origin. Indeed, as a reminder of this origin and the historical Buddha’s own simple patched garment, kesa are formed from many fragments of the same cloth. Within each garment, the fragments are typically organized in a series of columns framed by a border with mitered corners. The number of columns, ranging from five to 25 but most often seven, indicates both the specific function of that garment and also the rank of the wearer within the religious hierarchy. Many examples are adorned with six added squares, usually from a different fabric, that reinforced points of stress from wear but have assumed symbolic value as well. Attached rings, loops, and cords helped hold the garments in place when worn.
Although there are earlier examples, particularly in Japanese temple collections, most surviving kesa date from the Edo period (1615–1868) and the Meiji period (1868–1912). The fabrics used during these periods are often highly patterned and made of sumptuous materials, in aristocratic defiance of the garments’ humble beginnings. Some of the fabrics are reused garments—Noh theatrical robes, kimonos, even Chinese robes—donated to temples by wealthy devotees. This selection of 23 kesa shows both the range and exquisite intricacy of this beautiful and historically rich garment.

00101,
Become a Member Reserve a Ticket

Vincent van Gogh’s bedroom in Arles is arguably the most famous chambre in the history of art. It also held special significance for the artist, who created three distinct paintings of this intimate space from 1888 to 1889. This exhibition—presented only at the Art Institute of Chicago—brings together all three versions of The Bedroom for the first time in North America, offering a pioneering and in-depth study of their making and meaning to Van Gogh in his relentless quest for home.
Related Media
Visit the exhibition preview site.
Watch the exhibition videos.
Van Gogh painted his first Bedroom just after moving into his beloved “Yellow House” in Arles, France, in 1888. He was so enamored with the work, now in the collection of the Van Gogh Museum in Amsterdam, that after water damage threatened its stability, he became determined to preserve the composition by painting a second version while at an asylum in Saint-Rémy in 1889. Identical in scale and yet distinct from the original, that second work is now one of the icons of the Art Institute’s permanent collection. Van Gogh created a smaller third version, now at the Musée d’Orsay in Paris, as a gift for his mother and sister a few weeks after making the second. While the three paintings at first appear almost identical, when examined closely, each reveals distinct and unique details.
This exhibition is the first to truly delve into the fascinating history of these three paintings. Beginning with Van Gogh’s early canvases of cottages and birds’ nests, the show explores the artist’s use of the motif of home—as haven, creative chamber, and physical reality—and follows the evolution of this theme throughout his career, beyond the Yellow House to the asylum at Saint-Rémy. The presentation concludes with Van Gogh’s final residence in Auvers-sur-Oise, where he once again painted a series of cottages—returning to the idea that first evoked in him a sense of home.
Van Gogh’s Bedrooms features approximately 36 works by the artist, including paintings, drawings, and illustrated letters, as well as a selection of books and other ephemera known to have been in Van Gogh’s possession. Enhancing the exploration of the artist’s works and his longing for a place of his own are several engaging interactive presentations. A digitally enhanced reconstruction of his bedroom allows viewers the chance to experience his state of mind and the physical reality of the space that so inspired him, while other enriching digital components bring to light significant recent scientific research on the three Bedroom paintings. The result is an innovative yet intimate look at one of the most beloved and often-misunderstood artists of all time.
SponsorsLead support has been provided by the Estate of Jacquet McConville.
Major support has been generously provided by Caryn and King Harris, The Harris Family Foundation; the Gilchrist Foundation; The Morris and Dolores Kohl Kaplan Fund; and Evonne and John Yonover.    Additional funding has been contributed by Constance and David Coolidge, the Mason Foundation, Charlene and Mark Novak, and the Comer Family Foundation.  Annual support for Art Institute exhibitions is provided by the Exhibitions Trust: Kenneth Griffin, Robert M. and Diane v.S. Levy, Thomas and Margot Pritzker, Betsy Bergman Rosenfield and Andrew M. Rosenfield, the Earl and Brenda Shapiro Foundation, and the Woman’s Board.
The exhibition is supported by an indemnity from the Federal Council on the Arts and the Humanities.  Lead Corporate Sponsors


Conservation Sponsor


